{"$schema":"https://json-schema.org/draft/2020-12/schema","type":"object","required":["document_intent","through_line","reader_journey"],"properties":{"document_intent":{"type":"string"},"through_line":{"type":"string"},"must_appear_first":{"type":"array"},"secondary_content":{"type":"array"},"annex_content":{"type":"array"},"detail_level":{"type":"string"},"uncertainty_policy":{"type":"string"},"reader_journey":{"type":"array"}}}
