{"document_intent":"executive report","through_line":"make the next decision clear","must_appear_first":["verdict"],"secondary_content":["context"],"annex_content":["source ledger"],"detail_level":"decision-ready","uncertainty_policy":"show unknowns plainly","reader_journey":["verdict","reason","action"]}
