{
  "document_intent": "technical",
  "through_line": "Tie each technical observation to a decision or an owner.",
  "must_appear_first": [
    "verdict",
    "key_fact"
  ],
  "secondary_content": [
    "table",
    "technical_block",
    "risk_register"
  ],
  "annex_content": [
    "source_ledger"
  ],
  "detail_level": "dense technical report",
  "uncertainty_policy": "separate observed state from open risk",
  "reader_journey": [
    "identity",
    "result",
    "status",
    "command",
    "risk",
    "annex"
  ]
}
